{
  "name": "j_ortholog_clusters",
  "classification": "clustering",
  "description": "none",
  "tool_execution": [],
  "converters": {
    "main": [],
    "iterator": []
  },
  "input_modes": {
    "file": false,
    "list": false,
    "directory": false
  },
  "output_formats": [
    "fasta_output_list"
  ],
  "has_iterator": false,
  "group_count": "150",
  "parameters": [
    {
      "name": "PVALCUT",
      "default": "1e-5"
    },
    {
      "name": "PCOVERAGE_CUTOFF",
      "default": "70"
    },
    {
      "name": "PIDENTITY_CUTOFF",
      "default": ""
    },
    {
      "name": "PSIMILARITY_CUTOFF",
      "default": ""
    },
    {
      "name": "MAX_MULTI_ALIGNMENT",
      "default": "100"
    },
    {
      "name": "JACCARD_CUTOFF",
      "default": "0.0"
    },
    {
      "name": "USE_FEATURE_IDS_IN_FASTA",
      "default": "0"
    }
  ]
}