{
  "name": "genbank2gff3",
  "classification": "RNA-Seq",
  "description": "aligns reads against a single reference file contining one or more contigs",
  "tool_execution": [],
  "converters": {
    "main": [
      {
        "script": "genbank2gff3",
        "name": "genbank2gff3",
        "input": null,
        "output": null
      }
    ],
    "iterator": []
  },
  "input_modes": {
    "file": false,
    "list": false,
    "directory": false
  },
  "output_formats": [
    "bsml_output_list"
  ],
  "has_iterator": false,
  "group_count": "150",
  "parameters": [
    {
      "name": "GENBANK_FILE",
      "default": "/local/projects/ifx_core/rna_seq/tcreasy/rna_seq/output_repository/bowtie/37_default/NC_000117.1.gb"
    },
    {
      "name": "GFF3_FILE",
      "default": "/local/projects/ifx_core/rna_seq/tcreasy/rna_seq/output_repository/bowtie/37_default/NC_000117.1.rRNA.gff3"
    },
    {
      "name": "FEAT_TYPE",
      "default": "CDS"
    },
    {
      "name": "OTHER_ARGS",
      "default": ""
    }
  ]
}