{
  "name": "sam2fasta",
  "classification": "LGT",
  "description": "Lateral Genome Transfer sam2fasta converter",
  "tool_execution": [],
  "converters": {
    "main": [
      {
        "script": "sam2fasta",
        "name": "Convert sam to fasta",
        "input": null,
        "output": null
      }
    ],
    "iterator": []
  },
  "input_modes": {
    "file": false,
    "list": false,
    "directory": false
  },
  "output_formats": [
    "output_list"
  ],
  "has_iterator": false,
  "group_count": "150",
  "parameters": [
    {
      "name": "FASTQ",
      "default": "0"
    },
    {
      "name": "HLGT",
      "default": "0"
    },
    {
      "name": "HOST",
      "default": ""
    },
    {
      "name": "COMBINE_MATES",
      "default": "0"
    },
    {
      "name": "PAIRED",
      "default": "1"
    },
    {
      "name": "ASSUME_UNIQ",
      "default": "0"
    }
  ]
}