{
  "name": "predotar",
  "classification": "functional prediction",
  "description": "none",
  "tool_execution": [
    {
      "name": "predotar",
      "executable": "{{PREDOTAR_EXEC}}"
    },
    {
      "name": "dtd validation",
      "executable": "{{BIN_DIR}}/dtdValid.pl"
    }
  ],
  "converters": {
    "main": [],
    "iterator": [
      {
        "script": "predotar2bsml",
        "name": "predotar2bsml",
        "input": "{{OUTPUT_DIRECTORY}}/{{ITERATOR_NAME}}/g{{GROUP_NUMBER}}/{{I_FILE_BASE}}.{{COMPONENT_NAME}}.raw",
        "output": "{{OUTPUT_DIRECTORY}}/{{ITERATOR_NAME}}/g{{GROUP_NUMBER}}/{{I_FILE_BASE}}.{{COMPONENT_NAME}}.bsml"
      },
      {
        "script": "analysis2bsml",
        "name": "store config params",
        "input": null,
        "output": null
      }
    ]
  },
  "input_modes": {
    "file": false,
    "list": false,
    "directory": false
  },
  "output_formats": [
    "bsml_output_list",
    "raw_output_list"
  ],
  "has_iterator": true,
  "group_count": "150",
  "parameters": [
    {
      "name": "SEARCH_TYPE",
      "default": "p"
    },
    {
      "name": "COMPRESS_BSML_OUTPUT",
      "default": "1"
    }
  ]
}