{
  "name": "ncbi-blastn_compress",
  "classification": "alignment / pairwise",
  "description": "none",
  "tool_execution": [
    {
      "name": "ncbi-blastn_compress",
      "executable": "zcat -f {{I_FILE_PATH}} | {{BLASTALL_EXEC}}"
    },
    {
      "name": "dtd validation",
      "executable": "{{BIN_DIR}}/dtdValid.pl"
    }
  ],
  "converters": {
    "main": [],
    "iterator": [
      {
        "script": "blast2btab",
        "name": "convert raw to btab",
        "input": "{{OUTPUT_DIRECTORY}}/{{ITERATOR_NAME}}/g{{GROUP_NUMBER}}/{{I_FILE_BASE}}.{{COMPONENT_NAME}}.raw.gz",
        "output": "{{OUTPUT_DIRECTORY}}/{{ITERATOR_NAME}}/g{{GROUP_NUMBER}}/{{I_FILE_BASE}}.{{COMPONENT_NAME}}.btab"
      },
      {
        "script": "blast2bsml",
        "name": "convert raw to bsml",
        "input": "{{OUTPUT_DIRECTORY}}/{{ITERATOR_NAME}}/g{{GROUP_NUMBER}}/{{I_FILE_BASE}}.{{COMPONENT_NAME}}.raw",
        "output": "{{OUTPUT_DIRECTORY}}/{{ITERATOR_NAME}}/g{{GROUP_NUMBER}}/{{I_FILE_BASE}}.{{COMPONENT_NAME}}.bsml"
      },
      {
        "script": "analysis2bsml",
        "name": "store config params",
        "input": null,
        "output": null
      }
    ]
  },
  "input_modes": {
    "file": false,
    "list": false,
    "directory": false
  },
  "output_formats": [
    "bsml_output_list",
    "btab_output_list",
    "raw_output_list"
  ],
  "has_iterator": true,
  "group_count": "150",
  "parameters": [
    {
      "name": "EXPECT",
      "default": "1e-5"
    },
    {
      "name": "FILTER",
      "default": "T"
    },
    {
      "name": "DATABASE_MATCHES",
      "default": "150"
    },
    {
      "name": "DESCRIPTIONS",
      "default": "150"
    },
    {
      "name": "OTHER_OPTS",
      "default": ""
    },
    {
      "name": "FILTER_HSPS_FOR_STATS",
      "default": "1"
    },
    {
      "name": "COMPRESS_BSML_OUTPUT",
      "default": "1"
    }
  ]
}