{
  "name": "sff_to_CA",
  "classification": "file / conversion",
  "description": "none",
  "tool_execution": [],
  "converters": {
    "main": [],
    "iterator": []
  },
  "input_modes": {
    "file": false,
    "list": false,
    "directory": false
  },
  "output_formats": [
    "frg_output_list"
  ],
  "has_iterator": false,
  "group_count": "150",
  "parameters": [
    {
      "name": "LIBRARY",
      "default": ""
    },
    {
      "name": "LINKER",
      "default": ""
    },
    {
      "name": "TRIM",
      "default": "hard"
    },
    {
      "name": "CLEAR",
      "default": "454"
    },
    {
      "name": "INSERT_SIZE",
      "default": ""
    }
  ]
}