{
  "name": "nucmer-show-snps",
  "classification": "alignment",
  "description": "none",
  "tool_execution": [
    {
      "name": "create output directory",
      "executable": "mkdir"
    },
    {
      "name": "create temp directory",
      "executable": "mkdir"
    },
    {
      "name": "delta-filter",
      "executable": "$;SHOW_SNPS_EXEC$;"
    }
  ],
  "converters": {
    "main": [],
    "iterator": []
  },
  "input_modes": {
    "file": false,
    "list": false,
    "directory": false
  },
  "output_formats": [
    "snps_output_list"
  ],
  "has_iterator": true,
  "group_count": "150",
  "parameters": [
    {
      "name": "OTHER_OPTS",
      "default": ""
    }
  ]
}