{
  "name": "create_pseudomolecules",
  "classification": "utility",
  "description": "none",
  "tool_execution": [],
  "converters": {
    "main": [],
    "iterator": []
  },
  "input_modes": {
    "file": false,
    "list": false,
    "directory": false
  },
  "output_formats": [
    "output_list"
  ],
  "has_iterator": false,
  "group_count": "150",
  "parameters": [
    {
      "name": "STRAIN_NAME",
      "default": ""
    },
    {
      "name": "DATABASE",
      "default": "nucleotide"
    },
    {
      "name": "FORMAT",
      "default": "fasta"
    },
    {
      "name": "NUCMER_CONFIG",
      "default": "-c 100 -maxmatch"
    },
    {
      "name": "LINKER_SEQUENCE",
      "default": ""
    }
  ]
}