{
  "name": "ngap",
  "classification": "sequence / properties",
  "description": "none",
  "tool_execution": [
    {
      "name": "ngap",
      "executable": "{{BIN_DIR}}/ngap"
    },
    {
      "name": "dtd validation",
      "executable": "{{BIN_DIR}}/dtdValid.pl"
    }
  ],
  "converters": {
    "main": [],
    "iterator": [
      {
        "script": "analysis2bsml",
        "name": "store config params",
        "input": null,
        "output": null
      }
    ]
  },
  "input_modes": {
    "file": false,
    "list": false,
    "directory": false
  },
  "output_formats": [
    "bsml_output_list"
  ],
  "has_iterator": true,
  "group_count": "150",
  "parameters": []
}