{
  "name": "mothur_filter_seqs",
  "classification": "utility",
  "description": "none",
  "tool_execution": [
    {
      "name": "align seqs",
      "executable": "{{BIN_DIR}}/mothur"
    }
  ],
  "converters": {
    "main": [],
    "iterator": []
  },
  "input_modes": {
    "file": false,
    "list": false,
    "directory": false
  },
  "output_formats": [],
  "has_iterator": true,
  "group_count": "150",
  "parameters": [
    {
      "name": "VERTICAL",
      "default": "T"
    },
    {
      "name": "OTHER_OPTIONS",
      "default": ""
    }
  ]
}