{
  "name": "update_ec_numbers",
  "classification": "utility",
  "description": "Update EC numbers in the database",
  "tool_execution": [
    {
      "name": "update ec numbers",
      "executable": "{{BIN_DIR}}/update_ec_numbers"
    }
  ],
  "converters": {
    "main": [],
    "iterator": []
  },
  "input_modes": {
    "file": false,
    "list": false,
    "directory": false
  },
  "output_formats": [],
  "has_iterator": true,
  "group_count": "150",
  "parameters": [
    {
      "name": "HOST",
      "default": ""
    },
    {
      "name": "USERNAME",
      "default": ""
    },
    {
      "name": "PASSWORD",
      "default": ""
    },
    {
      "name": "PASSWORD_FILE",
      "default": ""
    },
    {
      "name": "EC_DAT_FILE",
      "default": "/local/db/expasy/enzyme/latest/enzyme.dat"
    },
    {
      "name": "NO_CHANGE",
      "default": "0"
    }
  ]
}